{
  "schema_version": "cme_equity_index_session_calendar_v1",
  "timezone": "America/Chicago",
  "market_hours_only": true,
  "source_capture_complete_inferred": false,
  "source_capture_policy_id": "source_capture_evidence_v1_separate_from_calendar",
  "sessions": [
    {
      "trade_date": 20250801,
      "session_class": "NORMAL",
      "expected_open_ct": "2025-07-31T17:00:00-05:00",
      "expected_close_ct": "2025-08-01T16:00:00-05:00",
      "holiday_name": null,
      "evidence": [
        {
          "url": "https://www.cmegroup.com/services/trading-hours-by-product?id=316,133,425,300,58,437,22,8478,5201,10191&pageNumber=1&pageSize=999&sortAsc=true&fromEventDate=2026-06-17&toEventDate=2026-06-22&isProtected",
          "sha256": "19ce16f2c59c3875e559a7cd35cddfc0ca187c82268d7e728a70fc0e26acb185",
          "retrieved_at": "2026-09-02T04:48:04+00:00"
        }
      ]
    },
    {
      "trade_date": 20250802,
      "session_class": "CLOSED",
      "expected_open_ct": null,
      "expected_close_ct": null,
      "holiday_name": "WEEKEND",
      "evidence": [
        {
          "url": "https://www.cmegroup.com/services/trading-hours-by-product?id=316,133,425,300,58,437,22,8478,5201,10191&pageNumber=1&pageSize=999&sortAsc=true&fromEventDate=2026-06-17&toEventDate=2026-06-22&isProtected",
          "sha256": "19ce16f2c59c3875e559a7cd35cddfc0ca187c82268d7e728a70fc0e26acb185",
          "retrieved_at": "2026-09-02T04:48:04+00:00"
        }
      ]
    },
    {
      "trade_date": 20250803,
      "session_class": "CLOSED",
      "expected_open_ct": null,
      "expected_close_ct": null,
      "holiday_name": "WEEKEND",
      "evidence": [
        {
          "url": "https://www.cmegroup.com/services/trading-hours-by-product?id=316,133,425,300,58,437,22,8478,5201,10191&pageNumber=1&pageSize=999&sortAsc=true&fromEventDate=2026-06-17&toEventDate=2026-06-22&isProtected",
          "sha256": "19ce16f2c59c3875e559a7cd35cddfc0ca187c82268d7e728a70fc0e26acb185",
          "retrieved_at": "2026-09-02T04:48:04+00:00"
        }
      ]
    },
    {
      "trade_date": 20250804,
      "session_class": "NORMAL",
      "expected_open_ct": "2025-08-03T17:00:00-05:00",
      "expected_close_ct": "2025-08-04T16:00:00-05:00",
      "holiday_name": null,
      "evidence": [
        {
          "url": "https://www.cmegroup.com/services/trading-hours-by-product?id=316,133,425,300,58,437,22,8478,5201,10191&pageNumber=1&pageSize=999&sortAsc=true&fromEventDate=2026-06-17&toEventDate=2026-06-22&isProtected",
          "sha256": "19ce16f2c59c3875e559a7cd35cddfc0ca187c82268d7e728a70fc0e26acb185",
          "retrieved_at": "2026-09-02T04:48:04+00:00"
        }
      ]
    },
    {
      "trade_date": 20250805,
      "session_class": "NORMAL",
      "expected_open_ct": "2025-08-04T17:00:00-05:00",
      "expected_close_ct": "2025-08-05T16:00:00-05:00",
      "holiday_name": null,
      "evidence": [
        {
          "url": "https://www.cmegroup.com/services/trading-hours-by-product?id=316,133,425,300,58,437,22,8478,5201,10191&pageNumber=1&pageSize=999&sortAsc=true&fromEventDate=2026-06-17&toEventDate=2026-06-22&isProtected",
          "sha256": "19ce16f2c59c3875e559a7cd35cddfc0ca187c82268d7e728a70fc0e26acb185",
          "retrieved_at": "2026-09-02T04:48:04+00:00"
        }
      ]
    },
    {
      "trade_date": 20250806,
      "session_class": "NORMAL",
      "expected_open_ct": "2025-08-05T17:00:00-05:00",
      "expected_close_ct": "2025-08-06T16:00:00-05:00",
      "holiday_name": null,
      "evidence": [
        {
          "url": "https://www.cmegroup.com/services/trading-hours-by-product?id=316,133,425,300,58,437,22,8478,5201,10191&pageNumber=1&pageSize=999&sortAsc=true&fromEventDate=2026-06-17&toEventDate=2026-06-22&isProtected",
          "sha256": "19ce16f2c59c3875e559a7cd35cddfc0ca187c82268d7e728a70fc0e26acb185",
          "retrieved_at": "2026-09-02T04:48:04+00:00"
        }
      ]
    },
    {
      "trade_date": 20250807,
      "session_class": "NORMAL",
      "expected_open_ct": "2025-08-06T17:00:00-05:00",
      "expected_close_ct": "2025-08-07T16:00:00-05:00",
      "holiday_name": null,
      "evidence": [
        {
          "url": "https://www.cmegroup.com/services/trading-hours-by-product?id=316,133,425,300,58,437,22,8478,5201,10191&pageNumber=1&pageSize=999&sortAsc=true&fromEventDate=2026-06-17&toEventDate=2026-06-22&isProtected",
          "sha256": "19ce16f2c59c3875e559a7cd35cddfc0ca187c82268d7e728a70fc0e26acb185",
          "retrieved_at": "2026-09-02T04:48:04+00:00"
        }
      ]
    },
    {
      "trade_date": 20250808,
      "session_class": "NORMAL",
      "expected_open_ct": "2025-08-07T17:00:00-05:00",
      "expected_close_ct": "2025-08-08T16:00:00-05:00",
      "holiday_name": null,
      "evidence": [
        {
          "url": "https://www.cmegroup.com/services/trading-hours-by-product?id=316,133,425,300,58,437,22,8478,5201,10191&pageNumber=1&pageSize=999&sortAsc=true&fromEventDate=2026-06-17&toEventDate=2026-06-22&isProtected",
          "sha256": "19ce16f2c59c3875e559a7cd35cddfc0ca187c82268d7e728a70fc0e26acb185",
          "retrieved_at": "2026-09-02T04:48:04+00:00"
        }
      ]
    },
    {
      "trade_date": 20250809,
      "session_class": "CLOSED",
      "expected_open_ct": null,
      "expected_close_ct": null,
      "holiday_name": "WEEKEND",
      "evidence": [
        {
          "url": "https://www.cmegroup.com/services/trading-hours-by-product?id=316,133,425,300,58,437,22,8478,5201,10191&pageNumber=1&pageSize=999&sortAsc=true&fromEventDate=2026-06-17&toEventDate=2026-06-22&isProtected",
          "sha256": "19ce16f2c59c3875e559a7cd35cddfc0ca187c82268d7e728a70fc0e26acb185",
          "retrieved_at": "2026-09-02T04:48:04+00:00"
        }
      ]
    },
    {
      "trade_date": 20250810,
      "session_class": "CLOSED",
      "expected_open_ct": null,
      "expected_close_ct": null,
      "holiday_name": "WEEKEND",
      "evidence": [
        {
          "url": "https://www.cmegroup.com/services/trading-hours-by-product?id=316,133,425,300,58,437,22,8478,5201,10191&pageNumber=1&pageSize=999&sortAsc=true&fromEventDate=2026-06-17&toEventDate=2026-06-22&isProtected",
          "sha256": "19ce16f2c59c3875e559a7cd35cddfc0ca187c82268d7e728a70fc0e26acb185",
          "retrieved_at": "2026-09-02T04:48:04+00:00"
        }
      ]
    },
    {
      "trade_date": 20250811,
      "session_class": "NORMAL",
      "expected_open_ct": "2025-08-10T17:00:00-05:00",
      "expected_close_ct": "2025-08-11T16:00:00-05:00",
      "holiday_name": null,
      "evidence": [
        {
          "url": "https://www.cmegroup.com/services/trading-hours-by-product?id=316,133,425,300,58,437,22,8478,5201,10191&pageNumber=1&pageSize=999&sortAsc=true&fromEventDate=2026-06-17&toEventDate=2026-06-22&isProtected",
          "sha256": "19ce16f2c59c3875e559a7cd35cddfc0ca187c82268d7e728a70fc0e26acb185",
          "retrieved_at": "2026-09-02T04:48:04+00:00"
        }
      ]
    },
    {
      "trade_date": 20250812,
      "session_class": "NORMAL",
      "expected_open_ct": "2025-08-11T17:00:00-05:00",
      "expected_close_ct": "2025-08-12T16:00:00-05:00",
      "holiday_name": null,
      "evidence": [
        {
          "url": "https://www.cmegroup.com/services/trading-hours-by-product?id=316,133,425,300,58,437,22,8478,5201,10191&pageNumber=1&pageSize=999&sortAsc=true&fromEventDate=2026-06-17&toEventDate=2026-06-22&isProtected",
          "sha256": "19ce16f2c59c3875e559a7cd35cddfc0ca187c82268d7e728a70fc0e26acb185",
          "retrieved_at": "2026-09-02T04:48:04+00:00"
        }
      ]
    },
    {
      "trade_date": 20250813,
      "session_class": "NORMAL",
      "expected_open_ct": "2025-08-12T17:00:00-05:00",
      "expected_close_ct": "2025-08-13T16:00:00-05:00",
      "holiday_name": null,
      "evidence": [
        {
          "url": "https://www.cmegroup.com/services/trading-hours-by-product?id=316,133,425,300,58,437,22,8478,5201,10191&pageNumber=1&pageSize=999&sortAsc=true&fromEventDate=2026-06-17&toEventDate=2026-06-22&isProtected",
          "sha256": "19ce16f2c59c3875e559a7cd35cddfc0ca187c82268d7e728a70fc0e26acb185",
          "retrieved_at": "2026-09-02T04:48:04+00:00"
        }
      ]
    },
    {
      "trade_date": 20250814,
      "session_class": "NORMAL",
      "expected_open_ct": "2025-08-13T17:00:00-05:00",
      "expected_close_ct": "2025-08-14T16:00:00-05:00",
      "holiday_name": null,
      "evidence": [
        {
          "url": "https://www.cmegroup.com/services/trading-hours-by-product?id=316,133,425,300,58,437,22,8478,5201,10191&pageNumber=1&pageSize=999&sortAsc=true&fromEventDate=2026-06-17&toEventDate=2026-06-22&isProtected",
          "sha256": "19ce16f2c59c3875e559a7cd35cddfc0ca187c82268d7e728a70fc0e26acb185",
          "retrieved_at": "2026-09-02T04:48:04+00:00"
        }
      ]
    },
    {
      "trade_date": 20250815,
      "session_class": "NORMAL",
      "expected_open_ct": "2025-08-14T17:00:00-05:00",
      "expected_close_ct": "2025-08-15T16:00:00-05:00",
      "holiday_name": null,
      "evidence": [
        {
          "url": "https://www.cmegroup.com/services/trading-hours-by-product?id=316,133,425,300,58,437,22,8478,5201,10191&pageNumber=1&pageSize=999&sortAsc=true&fromEventDate=2026-06-17&toEventDate=2026-06-22&isProtected",
          "sha256": "19ce16f2c59c3875e559a7cd35cddfc0ca187c82268d7e728a70fc0e26acb185",
          "retrieved_at": "2026-09-02T04:48:04+00:00"
        }
      ]
    },
    {
      "trade_date": 20250816,
      "session_class": "CLOSED",
      "expected_open_ct": null,
      "expected_close_ct": null,
      "holiday_name": "WEEKEND",
      "evidence": [
        {
          "url": "https://www.cmegroup.com/services/trading-hours-by-product?id=316,133,425,300,58,437,22,8478,5201,10191&pageNumber=1&pageSize=999&sortAsc=true&fromEventDate=2026-06-17&toEventDate=2026-06-22&isProtected",